{
  "$schema": "http://json-schema.org/draft-07/schema#",
  "id": "SpsAuthenticationType.json",
  "type": "object",
  "properties": {
    "actualDateTime": {
      "$ref": "DateTimeType.json"
    },
    "includedSpsClause": {
      "type": "array",
      "items": {
        "type": "object",
        "properties": {
          "content": {
            "type": "array",
            "items": {
              "allOf": [
                {
                  "$ref": "TextType.json"
                },
                {
                  "required": [
                    "value"
                  ]
                }
              ]
            }
          },
          "id": {
            "$ref": "IDType.json"
          }
        },
        "required": [
          "content"
        ]
      }
    },
    "issueSpsLocation": {
      "$ref": "SpsLocationType.json"
    },
    "locationProviderSpsParty": {
      "$ref": "SpsPartyType.json"
    },
    "providerSpsParty": {
      "$ref": "SpsPartyType.json"
    },
    "typeCode": {
      "$ref": "GovernmentActionCodeType.json"
    }
  },
  "required": [
    "actualDateTime",
    "includedSpsClause",
    "providerSpsParty"
  ]
}
